{
  "schema_version": "v2",
  "succeeded": true,
  "outcome_code": "accepted",
  "intake_id": "11111111-1111-4111-8111-111111111111",
  "submission_id": "22222222-2222-4222-8222-222222222222",
  "status": "accepted",
  "revision": 2,
  "version_id": "33333333-3333-4333-8333-333333333333",
  "version_number": 1,
  "permitted_actions": ["preview_item", "download_item", "return_to_my_work"]
}
